{
  "assets": [
    {
      "bytes": 1017814,
      "path": "DEPENDENCY-LICENSES.txt",
      "sha256": "974f7f92488e9e086df62dcac3a8a868309605b54753b26b397cc1ac38dc7d78"
    },
    {
      "bytes": 1066,
      "path": "LICENSE.md",
      "sha256": "b6d8b02e500c8743effdbce62ae6e5ff253802c0fee7d71a09f843094c5d0584"
    },
    {
      "bytes": 9392,
      "path": "THIRD_PARTY_NOTICES.md",
      "sha256": "ae5650bc7e25eeb8b3e5be19747803b2ca313afe103c90f5214e3437479d102d"
    },
    {
      "bytes": 4688384,
      "path": "WsprryPico-0.1.0-ci.39084514130.1-pico2_w.uf2",
      "sha256": "4e5c5f1de45f12ae5499f2e6ff4e07115f22d69e1e3a476c0f4ba7c01e4513b0"
    }
  ],
  "audit_assets": [
    {
      "bytes": 5235,
      "path": "build-inputs.json",
      "sha256": "49daf52b0ce951d927a1edbbd521fc28c355ff952afeb2cb268f7119df9a501e"
    },
    {
      "bytes": 65931,
      "path": "compatibility.log",
      "sha256": "88f79e0fc3c881934634775349ac674de60efd233ac1e401e9fbaa78ce4a0281"
    },
    {
      "bytes": 35412,
      "path": "consumer/CMakeCache.txt",
      "sha256": "70977796b571ba257ec7a3c4ba7ea9bdaab1967d6888f0df709715c11d0cc777"
    },
    {
      "bytes": 39768084,
      "path": "consumer/WsprryPico.elf",
      "sha256": "10ecc8338b7904ed6f8c979f813c837a5b3788d31a689bd80500813c0bf4346e"
    },
    {
      "bytes": 3702143,
      "path": "consumer/WsprryPico.elf.map",
      "sha256": "40f72e05f5d9e790bd4a8b78aa907bd0136545d0bd62917f513595d1e4dc900f"
    },
    {
      "bytes": 4688384,
      "path": "consumer/WsprryPico.uf2",
      "sha256": "4e5c5f1de45f12ae5499f2e6ff4e07115f22d69e1e3a476c0f4ba7c01e4513b0"
    },
    {
      "bytes": 21265514,
      "path": "consumer/compile_commands.json",
      "sha256": "fd4fdd4eede3626355d3f6001da24408099333348ebb38c08d6d5122c38bb9e6"
    },
    {
      "bytes": 544,
      "path": "consumer/firmware_identity.hpp",
      "sha256": "5e48fbcc35f679a741a9fe163fcbbe3cb68be3728f370083030404d416031d6f"
    },
    {
      "bytes": 92324,
      "path": "consumer/overlays/cyw43-tx-overlay/cyw43_ll.c",
      "sha256": "de277737c438b940dbbf441bf4c1c1a3ab51afe7063213fc7bfc7fa10aeeb530"
    },
    {
      "bytes": 239728,
      "path": "consumer/overlays/mbedtls-alert-overlay/ssl_msg.c",
      "sha256": "8a185116dff96293cf1e2b0e00007867d5580bc1954b1f8f572bb54f76142817"
    },
    {
      "bytes": 337558,
      "path": "consumer/overlays/mbedtls-alert-overlay/ssl_tls.c",
      "sha256": "e75f4dff980476ffc6eccd6bdf4cdfd47ad4e8192841e43859ffb330435dd169"
    },
    {
      "bytes": 61019,
      "path": "consumer/overlays/mbedtls-alert-overlay/ssl_tls13_generic.c",
      "sha256": "8e9d754d6572c47a5dfea0a06df8be3f9d5ab671e1d0457917ee30061eb8468b"
    },
    {
      "bytes": 860,
      "path": "consumer/picotool-info.txt",
      "sha256": "ca5bf8f76bbd1c0ca35d2d70221f7f633bfb14e678ec81506b50632b5d63a8cf"
    },
    {
      "bytes": 1854,
      "path": "consumer-ui/requests.jsonl",
      "sha256": "30b5c16f0630bd1c8159d862d27515b199e619cfe3df66f0b5a80dd9a0e8fb82"
    },
    {
      "bytes": 194,
      "path": "consumer-ui/result.json",
      "sha256": "dd124b0a6aab5571c65ea9ccc8ed97d3f64c5bcab1e3d70a1249723d47dbe72b"
    },
    {
      "bytes": 105137,
      "path": "consumer-ui/saved-desktop.png",
      "sha256": "543d5a7ad5193ffb51590344204eecd80639628900682a3af0a49ad368fa2981"
    },
    {
      "bytes": 71205,
      "path": "consumer-ui/saved-mobile.png",
      "sha256": "a9fbe9ee9ed24d8d68991a10c900e505fc8f3dda82f207543f814943324000f3"
    },
    {
      "bytes": 103916,
      "path": "consumer-ui/unset-desktop.png",
      "sha256": "3da17ad22e43c840acea166792d7f77eea882b3edce7188eb51e85335aece4ad"
    },
    {
      "bytes": 68910,
      "path": "consumer-ui/unset-mobile.png",
      "sha256": "950103098a4c0faa024373be23fad5ad6561a7d41bcb82e0ea04f5e5e0bfd69b"
    },
    {
      "bytes": 94966,
      "path": "consumer.log",
      "sha256": "e97a8a6d590237dc23e9fa66f0d7ea015e7a7fae5eebbf64a475a29806ebcd49"
    },
    {
      "bytes": 10934,
      "path": "evidence-skips.json",
      "sha256": "4de8935a3d90ab65d5f5c33c0715bd2c696583232b64856504f8f47351dd8349"
    },
    {
      "bytes": 69458,
      "path": "host-tests.xml",
      "sha256": "55d5b1d6fc5d171817c40cbcd25f14b909a15c35b353edd1d9d6d9f98d5e92b1"
    },
    {
      "bytes": 118308,
      "path": "host.log",
      "sha256": "c0b779fffdc2e1f6b42304b0847edccc1fbc2540599322ceb774d739ffcb01ed"
    },
    {
      "bytes": 35520,
      "path": "inhibited-regression/CMakeCache.txt",
      "sha256": "5474db8aa65073a3696e68648615416690e97ad3c83cedf686a4a41c17ca39c2"
    },
    {
      "bytes": 39121888,
      "path": "inhibited-regression/WsprryPico-Inhibited.elf",
      "sha256": "32512b216572c324415a0a9d020f58a63b10587c5fcd8361874e002017c1bf72"
    },
    {
      "bytes": 3774053,
      "path": "inhibited-regression/WsprryPico-Inhibited.elf.map",
      "sha256": "ea343e21f264ec39bae9d5a827f287d38c54b5eaadbe0a8c1dfd444488b1681a"
    },
    {
      "bytes": 21411194,
      "path": "inhibited-regression/compile_commands.json",
      "sha256": "d4aae92d59ca222554528fe62d0a2356fac1a7dd82d58330b0b36cb3032e9d8c"
    },
    {
      "bytes": 544,
      "path": "inhibited-regression/firmware_identity.hpp",
      "sha256": "5e48fbcc35f679a741a9fe163fcbbe3cb68be3728f370083030404d416031d6f"
    },
    {
      "bytes": 92324,
      "path": "inhibited-regression/overlays/cyw43-tx-overlay/cyw43_ll.c",
      "sha256": "de277737c438b940dbbf441bf4c1c1a3ab51afe7063213fc7bfc7fa10aeeb530"
    },
    {
      "bytes": 239728,
      "path": "inhibited-regression/overlays/mbedtls-alert-overlay/ssl_msg.c",
      "sha256": "8a185116dff96293cf1e2b0e00007867d5580bc1954b1f8f572bb54f76142817"
    },
    {
      "bytes": 337558,
      "path": "inhibited-regression/overlays/mbedtls-alert-overlay/ssl_tls.c",
      "sha256": "e75f4dff980476ffc6eccd6bdf4cdfd47ad4e8192841e43859ffb330435dd169"
    },
    {
      "bytes": 61019,
      "path": "inhibited-regression/overlays/mbedtls-alert-overlay/ssl_tls13_generic.c",
      "sha256": "8e9d754d6572c47a5dfea0a06df8be3f9d5ab671e1d0457917ee30061eb8468b"
    },
    {
      "bytes": 894,
      "path": "inhibited-regression/picotool-info.txt",
      "sha256": "fdcffa5c79b35e655f148104454a925412e7409e13049f207cc149e69f21dbbd"
    },
    {
      "bytes": 88539,
      "path": "inhibited-regression.log",
      "sha256": "f1fc5ef8a5efc69e2a843c335c9bb7caa63e2b7f7b6c168d846c7647e7bc5214"
    },
    {
      "bytes": 126311,
      "path": "registered-tests.json",
      "sha256": "29d23261b6c9b2da48dc8c6ee86cd65786b62be515391208723a2c695f07e3e4"
    },
    {
      "bytes": 95008,
      "path": "reproducibility.log",
      "sha256": "3d39a1261563076ba9fd786f7cb2608bd4e3dc70f5022ccefe6f4efd9137df64"
    }
  ],
  "build_inputs": {
    "companion": {
      "repository": "https://github.com/WsprryPi/WsprryPi.git",
      "revision": "c39fae35a77afb0f9a1fbe741a4f1fbdf9cbdccf",
      "submodules": []
    },
    "environment": {
      "ImageOS": "ubuntu24",
      "ImageVersion": "20261012.334.1",
      "RUNNER_ARCH": "X64",
      "RUNNER_OS": "Linux",
      "versions": {
        "chrome": "Google Chrome 155.0.8059.39",
        "cmake": "cmake version 3.31.6\n\nCMake suite maintained and supported by Kitware (kitware.com/cmake).",
        "host_cxx": "c++ (Ubuntu 13.3.0-6ubuntu2~24.04.1) 13.3.0\nCopyright (C) 2023 Free Software Foundation, Inc.\nThis is free software; see the source for copying conditions.  There is NO\nwarranty; not even for MERCHANTABILITY or FITNESS FOR A PARTICULAR PURPOSE.",
        "ninja": "1.11.1.git.kitware.jobserver-1",
        "node": "v24.8.0",
        "openssl": "OpenSSL 3.0.13 30 Jan 2024 (Library: OpenSSL 3.0.13 30 Jan 2024)",
        "pip": "attrs==25.3.0\ncffi==2.0.0\ncmake==3.31.6\ncryptography==46.0.2\njsonschema==4.25.1\njsonschema-specifications==2025.4.1\nninja==1.11.1.4\nnumpy==2.3.3\npycparser==2.23\npyserial==3.5\nPyYAML==6.0.3\nreferencing==0.36.2\nrpds-py==0.27.1\ntyping_extensions==4.15.0",
        "python": "Python 3.12.11",
        "system_packages": "g++\t4:13.2.0-7ubuntu1\ngcc\t4:13.2.0-7ubuntu1\nlibssl-dev:amd64\t3.0.13-0ubuntu3.16"
      }
    },
    "harness": {
      "repository": "https://github.com/WsprryPi/WsprryPi-Qualification-Harness.git",
      "revision": "62aa6e2ffa904a10b674bb1792a3bd66ba8afea6",
      "submodules": []
    },
    "linked_resources": {
      "cyw43_btfw_43439.h": "d05a8dca7e232ada470d8ed723edaa1ea78000098870f9b979d490d83ad35b22",
      "wb43439A0_7_95_49_00_combined.h": "6b4b9a717c3c5d669b56a3bc38b58df3901f63e3a7363ccf5d74706460762176",
      "wifi_nvram_43439.h": "ddc82b00667643f55d7687bba1b5e4028f24717ec8883f05bd7d435f4c9c01ad"
    },
    "npm_lock_sha256": "bdbfa0075c62c01c1450facce1941908e242e91c86d09a538ac6656c2afce39f",
    "overlays": {
      "consumer": {
        "cyw43-tx-overlay/cyw43_ll.c": "de277737c438b940dbbf441bf4c1c1a3ab51afe7063213fc7bfc7fa10aeeb530",
        "mbedtls-alert-overlay/ssl_msg.c": "8a185116dff96293cf1e2b0e00007867d5580bc1954b1f8f572bb54f76142817",
        "mbedtls-alert-overlay/ssl_tls.c": "e75f4dff980476ffc6eccd6bdf4cdfd47ad4e8192841e43859ffb330435dd169",
        "mbedtls-alert-overlay/ssl_tls13_generic.c": "8e9d754d6572c47a5dfea0a06df8be3f9d5ab671e1d0457917ee30061eb8468b"
      },
      "inhibited-regression": {
        "cyw43-tx-overlay/cyw43_ll.c": "de277737c438b940dbbf441bf4c1c1a3ab51afe7063213fc7bfc7fa10aeeb530",
        "mbedtls-alert-overlay/ssl_msg.c": "8a185116dff96293cf1e2b0e00007867d5580bc1954b1f8f572bb54f76142817",
        "mbedtls-alert-overlay/ssl_tls.c": "e75f4dff980476ffc6eccd6bdf4cdfd47ad4e8192841e43859ffb330435dd169",
        "mbedtls-alert-overlay/ssl_tls13_generic.c": "8e9d754d6572c47a5dfea0a06df8be3f9d5ab671e1d0457917ee30061eb8468b"
      }
    },
    "picotool": {
      "repository": "https://github.com/raspberrypi/picotool.git",
      "revision": "6f6458d792b93685a11423b244a585eaa99eafcf",
      "submodules": []
    },